{
 "meta": {
  "schema": "optiondesk/backtest/v1",
  "generated_utc": "2026-09-08T22:15:43+00:00",
  "tool": "optiondesk backtest",
  "shell_version": "0.3.0",
  "engine_version": "0.3.0",
  "provider_used": "synthetic teaching sample",
  "degraded": false,
  "degraded_reason": null,
  "notes": [
   "Synthetic teaching inputs. No observed quotes, holdings, or price history. Not market-performance evidence.",
   "Entries overlap: each trade shares days with 5 of its neighbours, so the significance test flips signs a block at a time and the interval resamples blocks. Treating these as 134 independent trades would understate the standard error by roughly a factor of two.",
   "the permutation test cannot distinguish this result from a rule with no edge"
  ],
  "inputs": {
   "symbol": "SYNTH",
   "strategy": "strangle",
   "holding_days": 30,
   "entry_every": 5,
   "period": "5y"
  },
  "disclaimer": "Research output, not investment advice, and not a recommendation or solicitation. Option premiums here are theoretical model values, not quotes and not achievable fills. Market data is third-party, may be delayed or wrong, and its redistribution is governed by the provider's terms. No warranty. See DISCLAIMER.md.",
  "license": "Produced by optiondesk under the PolyForm Noncommercial License 1.0.0. Noncommercial use is permitted; commercial use requires a separate written agreement with the copyright holder. See LICENSE and LICENSES.md."
 },
 "underlying": "SYNTH",
 "strategy": "strangle",
 "premium_source": "model",
 "honesty": "Synthetic teaching history with modeled option premiums. These outcomes describe an authored scenario, not observed market performance. No spread, slippage, assignment, or early exercise.",
 "settings": {
  "holding_days": 30,
  "entry_every": 5,
  "lookback": 60,
  "rate": 0.04,
  "dividend_yield": 0.0,
  "size": 1.0,
  "first_date": "2023-10-16",
  "last_date": "2026-09-08",
  "equity_curve": [
   -1.0,
   -1.9248068165742729,
   -2.924806816574273,
   -3.90313299929956,
   -4.90313299929956,
   -5.90313299929956,
   -6.90313299929956,
   -7.90313299929956,
   -8.90313299929956,
   -9.90313299929956,
   -10.90313299929956,
   -11.90313299929956,
   -12.90313299929956,
   -11.75127752752904,
   -9.331512004141885,
   -6.420953925119089,
   -4.876388782915386,
   -4.177856616112962,
   -5.177856616112962,
   -4.911050839444786,
   -4.554478726564684,
   -4.679148130539077,
   -5.679148130539077,
   -5.830293839135284,
   -6.522111651888609,
   -6.6221250058962315,
   -7.159807242644951,
   -8.141671203268627,
   -9.141671203268627,
   -8.529659592575783,
   -9.529659592575783,
   -10.529659592575783,
   -11.529659592575783,
   -12.529659592575783,
   -13.529659592575783,
   -14.529659592575783,
   -14.514179325291604,
   -15.514179325291604,
   -16.33206171167205,
   -15.675852573575273,
   -15.117086907435663,
   -14.886368486999007,
   -15.833248668315344,
   -16.833248668315342,
   -17.833248668315342,
   -18.833248668315342,
   -19.833248668315342,
   -20.833248668315342,
   -21.833248668315342,
   -22.833248668315342,
   -23.534897958598194,
   -22.725972991259464,
   -21.12929607640979,
   -18.65087875516653,
   -16.476062159645267,
   -15.113185306825828,
   -12.793791146596881,
   -11.751024750096207,
   -11.739767127565258,
   -10.57387504398184,
   -8.882791833745072,
   -8.138712005733373,
   -8.952658107712804,
   -9.952658107712804,
   -9.848236695319125,
   -5.3154531734131805,
   -2.3837510112972855,
   -2.4845349803403107,
   -2.626494509579543,
   -1.0985962571402519,
   -1.7390905738658717,
   -2.7390905738658717,
   -3.7390905738658717,
   -3.8024336066565176,
   -2.829004193238107,
   -2.5498874928150084,
   -2.3274044956480022,
   -2.169864822104706,
   -0.689429180819406,
   1.7863115341278946,
   2.9026536736153736,
   4.569280099197219,
   5.419928852425554,
   7.663989529160396,
   8.15434286363339,
   10.366904733981311,
   10.993134327097398,
   9.993134327097398,
   9.097609631761815,
   8.097609631761815,
   7.097609631761815,
   8.803295762365792,
   11.306535244407286,
   13.619533434959253,
   16.193454069672736,
   20.619967768552257,
   24.70369141741548,
   29.859152924473662,
   32.09295092141389,
   32.0535308158908,
   31.066187361063843,
   30.566463814601526,
   31.082656891214576,
   33.59781070448965,
   35.053186424352624,
   34.97681647402891,
   34.37525930002538,
   33.37525930002538,
   32.37525930002538,
   31.375259300025377,
   30.862927605263305,
   29.862927605263305,
   28.862927605263305,
   27.862927605263305,
   27.76249025232342,
   26.76249025232342,
   25.76249025232342,
   24.83844931297621,
   24.31485576947605,
   25.135683193112524,
   27.089932050358794,
   29.114099266075396,
   30.224991085824726,
   30.862062322440746,
   30.211970107215283,
   29.211970107215283,
   28.211970107215283,
   28.229933403459395,
   27.229933403459395,
   27.033162644365504,
   26.033162644365504,
   26.11071261244045,
   28.601306659959064,
   28.527419893414127
  ]
 },
 "statistics": {
  "trades": 134,
  "win_rate": 0.44029850746268656,
  "mean_return": 0.21289119323443376,
  "median_return": -0.1246694039743925,
  "stdev": 1.4205141778429515,
  "best": 5.155461507058182,
  "worst": -1.0,
  "mean_win": 1.5139962097468478,
  "mean_loss": -0.8106447530886652,
  "profit_factor": 1.469213668662643,
  "total_return_on_risk": 28.527419893414127,
  "max_drawdown_in_risk_units": 23.534897958598194,
  "accounting": "one unit of capital at risk per trade, returns summed rather than compounded, so the curve and the drawdown are in units of per-trade risk",
  "sharpe_per_trade": 0.14986910835181433,
  "sharpe_annualised": 0.43436194234832554,
  "trades_per_year": 8.4
 },
 "significance": {
  "p_value": 0.2863568215892054,
  "trials": 2000,
  "block": 6,
  "observed_mean": 0.21289119323443376,
  "null": "the sign of each block of overlapping trades is arbitrary, which is what a rule with no edge produces",
  "caveat": "A p-value is only a p-value for a hypothesis chosen before seeing the data. A rule selected because its backtest looked good has already spent its degrees of freedom, and this number then understates how easily the result could be chance."
 },
 "interval": {
  "mean": 0.21289119323443376,
  "lower": -0.1122176765498892,
  "upper": 0.5771988202677161,
  "level": 0.9,
  "trials": 2000,
  "block": 6,
  "excludes_zero": false
 },
 "benchmark": {
  "description": "buy and hold the underlying over the same windows, for comparison",
  "statistics": {
   "trades": 134,
   "win_rate": 0.5223880597014925,
   "mean_return": 0.005934032155219264,
   "median_return": 0.007653808197260581,
   "stdev": 0.08108143295250098,
   "best": 0.16895327064570576,
   "worst": -0.19648878187765184,
   "mean_win": 0.06896520915584918,
   "mean_loss": -0.0630063176892197,
   "profit_factor": 1.1971926035461065,
   "total_return_on_risk": 0.7951603087993814,
   "max_drawdown_in_risk_units": 1.3712362566981058,
   "accounting": "one unit of capital at risk per trade, returns summed rather than compounded, so the curve and the drawdown are in units of per-trade risk",
   "sharpe_per_trade": 0.07318607897193345,
   "sharpe_annualised": 0.21211340859173206,
   "trades_per_year": 8.4
  }
 },
 "trades": [
  {
   "entry_date": "2024-01-08",
   "exit_date": "2024-02-19",
   "entry_spot": 88.34348309394733,
   "exit_spot": 91.67126046519869,
   "underlying_return": 0.03766862313672292,
   "entry_volatility": 0.22466293372254093,
   "net_cash": -2.6504060925924726,
   "trade_type": "debit",
   "capital_at_risk": 2.6504060925924726,
   "profit": -2.6504060925924726,
   "return_on_risk": -1.0,
   "breakevens": [
    82.159594,
    94.530406
   ],
   "legs": [
    {
     "kind": "call",
     "side": "long",
     "strike": 91.88,
     "price": 1.4996620457058505,
     "qty": 1.0,
     "symbol": "SYNC91.88",
     "bid": 1.4996620457058505,
     "ask": 1.4996620457058505,
     "iv": 0.22466293372254093,
     "open_interest": 1000,
     "volume": 100
    },
    {
     "kind": "put",
     "side": "long",
     "strike": 84.81,
     "price": 1.1507440468866221,
     "qty": 1.0,
     "symbol": "SYNP84.81",
     "bid": 1.1507440468866221,
     "ask": 1.1507440468866221,
     "iv": 0.22466293372254093,
     "open_interest": 1000,
     "volume": 100
    }
   ]
  },
  {
   "entry_date": "2024-01-15",
   "exit_date": "2024-02-26",
   "entry_spot": 88.29984983599215,
   "exit_spot": 92.0247411227337,
   "underlying_return": 0.04218457102316875,
   "entry_volatility": 0.22176825750890305,
   "net_cash": -2.5898773513966304,
   "trade_type": "debit",
   "capital_at_risk": 2.5898773513966304,
   "profit": -2.3951362286629276,
   "return_on_risk": -0.924806816574273,
   "breakevens": [
    82.180123,
    94.419877
   ],
   "legs": [
    {
     "kind": "call",
     "side": "long",
     "strike": 91.83,
     "price": 1.4680027993690743,
     "qty": 1.0,
     "symbol": "SYNC91.83",
     "bid": 1.4680027993690743,
     "ask": 1.4680027993690743,
     "iv": 0.22176825750890305,
     "open_interest": 1000,
     "volume": 100
    },
    {
     "kind": "put",
     "side": "long",
     "strike": 84.77,
     "price": 1.1218745520275561,
     "qty": 1.0,
     "symbol": "SYNP84.77",
     "bid": 1.1218745520275561,
     "ask": 1.1218745520275561,
     "iv": 0.22176825750890305,
     "open_interest": 1000,
     "volume": 100
    }
   ]
  },
  {
   "entry_date": "2024-01-22",
   "exit_date": "2024-03-04",
   "entry_spot": 91.8116447953633,
   "exit_spot": 93.78903473238744,
   "underlying_return": 0.021537463373316967,
   "entry_volatility": 0.2337685774998436,
   "net_cash": -2.9584081419296027,
   "trade_type": "debit",
   "capital_at_risk": 2.9584081419296027,
   "profit": -2.9584081419296027,
   "return_on_risk": -1.0,
   "breakevens": [
    85.181592,
    98.438408
   ],
   "legs": [
    {
     "kind": "call",
     "side": "long",
     "strike": 95.48,
     "price": 1.6671338993478066,
     "qty": 1.0,